action,ms,bytes,lang,code,repeat,minver,comment
fail,0,0,q,.pq.getfile[1],1,,Check function doesnt seg with a bad argument
run,0,0,q,@[.pq.getfile;1;1b],1,,Check function can be error trapped when failing
true,0,0,q,98h= type .pq.getfile getdatafile "test2.parquet",1,,Suppose dtofail as schema cant be obtained
fail,0,0,q,.pq.getfile[getdatafile "doesntexist"],1,,
true,0,0,q,`error=@[.pq.getfile;getdatafile "doesntexist";{[x] `$x}],1,,Check that error returned is `error`
true,0,0,q,99h=type (myo[`libname] 2:(`getparquetlib;1))[],1,,This test is a bit irrelevant
true,0,0,q,2878=count .pq.getfile[getdatafile "test2.parquet"],1,,
true,0,0,q, all 10=type each .pq.versioninfo[],1,,Check that version function exists
true,0,0,q,,1,,Check that reading a file that exists but isnt a parquet file returns a trappable error